id,adv1_titre,adv2_titre,adv1_sous_titre,adv2_sous_titre,adv1_round1_texte,adv2_round1_texte,adv1_round2_texte,adv2_round2_texte,adv1_round3_texte,adv2_round3_texte,verdict,signature,credit_photo,url_signature,vainqueur,publie,sondage_partage
2654,Philippe Etchebest,Gordon Ramsay,"Chef français doublement étoilé, 48 ans","Chef star britannique multi-étoilé, 49 ans","<p><strong>Chaud devant !</strong> Ce meilleur ouvrier de France, qui terrorise les restaurateurs dans ""Cauchemar en cuisine"" (M6), déboule à Bordeaux : le chef d’origine basque ouvre sa brasserie ""abordable"", Le Quatrième Mur, place de la Comédie. Juste en face, son alter ego britannique, le fulminant Gordon Ramsay, prend les rênes du Pressoir d’argent, restaurant gastronomique du Grand Hôtel. ""C’est énorme, génial"", confie Etchebest dans un sourire poli. On savoure déjà le duel des deux toqués grandes gueules.</p>","<p><strong>Show devant !</strong> Le vrai chef superstar de ""Kitchen Nightmares"" version anglaise (déclinée dans 150 pays dont 30 adaptations), c’est lui. Gordon débarque fin septembre dans la ville d’Alain Juppé pour rafler des étoiles. Il en a déjà sept au compteur, mais compte bien rebooster les cuisines assoupies de ce Grand Hôtel. Comme tout toqué overbooké, il déléguera les fourneaux à son chef exécutif Gilad Peled, un Israélien qui a œuvré pour Tsahal pendant cinq ans. Ça va filer doux !</p>","<p><strong>À point.</strong> Avec son physique de colosse, Etchebest a grandi au sein d’une famille de restaurateurs. Mais il s’est d’abord passionné pour le rugby (il a joué en championnat de France) et la boxe. Peu importe, droit dans son tablier, il a fini par avoir deux étoiles à l’Hostellerie de plaisance, à Saint-Emilion (qu’il a quitté depuis), tout en montrant son col tricolore à la télé. Devenu ambassadeur de la bière Kronenbourg et du ""goût à la française"", il rêve désormais de reconquérir ses étoiles à Bordeaux et compte ouvrir une nouvelle adresse haut de gamme d’ici à quelques mois. Tout comme Gordon ?</p>","<p><strong>Saignant.</strong> Avec sa gueule d’ange cabossée et son caractère de pitbull, l’enfant de Glasgow a grandi au sein d’une famille ouvrière. Comme Etchebest, il a testé le sport de haut niveau, le foot, mais une méchante blessure le condamnera à tenter l’école hôtelière. Il atterrira ensuite chez Guy Savoy et Joël Robuchon. Aujourd’hui, il a coiffé ses maîtres au poteau en fondant un empire de la bouffe (livres, émissions culinaires, 27 restaurants dans le monde…) qui le classe parmi les chefs les plus riches au classement ""Forbes"". Et Gordon ne compte pas s’arrêter là. Malgré les accusations de fraude fiscale, il garde un appétit d’ogre.</p>","<p><strong>Le cauchemar continue.</strong> Etchebest, c’est une grosse voix mais un cœur d’artichaut. Sa verve est loin d’égaler celle de Ramsay même lorsqu’il traite de ""crétin"" un cuistot penaud. Peu importe, il attire quand même plus de 3,5 millions de téléspectateurs. Ça donne envie de continuer à martyriser les chefs à la ramasse. Et de publier son autobiographie ce mois-ci, ""Je ne lâche rien"" (Michel Lafon).</p>","<p><strong>La fin du cauchemar.</strong> Si depuis 2004 l’émission ""Kitchen Nightmares"" lui a permis d’accéder à la gloire populaire à coups de ""fuck"" mis à toutes les sauces et de critiques tout en finesse (""Ta soupe a un goût de pisse""), Gordon s’est rangé des casseroles cathodiques (même s’il reste jury du MasterChef américain). Il peut se le permettre : en 2014, il a gagné 54 millions d’euros.</p>","<p>C’est un match 100% testostérone mais pas encore à couteaux tirés. Moins arrogant, Philippe Etchebest marque l’essai, mais Gordon a du talent. Le 25 septembre prochain, lors de l’inauguration du Pressoir d’argent, qui osera lui balancer : ""J’ai l’impression de manger des putains de tongs avec de la mayonnaise"" ?</p>",Dorane Vignando,Citizenside/Thierry Thorel/ AFP - Dominic O'Neill/REX Shu/SIPA,http://o.nouvelobs.com/journaliste/14987/dorane-vignando.html,aucun,oui,oui
2652,Renaud Séchan,Thierry Séchan,"
63 ans, chanteur, auteur compositeur
","66 ans, écrivain, parolier et frère aîné du chanteur
","<p><strong>Laisse béton !</strong> En cette fin d’été, au moment d’entrer en studio pour enregistrer son premier album depuis six ans, qui doit sortir d’ici à Noël, c’est par le biais de son avocat que Renaud a recadré son bavard de frangin. Dans l’album, il y a ""de très jolies choses et des choses très médiocres"", a laissé entendre Thierry Séchan. Renaud non seulement se ""dissocie de l’intégralité de ses propos"", mais pis, il annonce que son grand frère ne participera en aucun cas au dit album. Pour les fans du chanteur, c’est bien mérité.
</p>","<p><strong>Pochtron !</strong> En sa qualité d’aîné et de biographe, Thierry s’autoproclame porte-parole et annonce le retour miraculeux de Renaud. Mais sous prétexte d’informer le public de l’avancée des travaux, il tacle ce frère qu’il adule et jalouse. Il ne s’est d’ailleurs pas contenté de tailler l’album : Renaud ""s’enfile sa demi-bouteille de pastis par jour"", a-t-il aussi confié. Thierry, une grenade dégoupillée dans la com du chanteur.</p>","<p><strong>Ma gonzesse.</strong> Depuis 2006, déjà, les deux frères sont en froid. Motif de la brouille : Renaud épouse Romane Serda, en qui Thierry ne voit qu’une petite arriviste. Renaud, lui, déclare et chante alors qu’il aime cette amazone venue le sauver des ténèbres. Il ne supporte pas les attaques répétées de son frère contre la mère de son fils Malone. Même si la chanteuse est devenue son ex en 2011...</p>","<p><strong>Sa môme.</strong> Auteur d’un texte pour le nouvel album de son frérot, Thierry a mal supporté de le voir rejeté par Renan Luce. Ce dernier, auteur-compositeur et gendre de Renaud, a été appelé à la rescousse pour composer les musiques du nouvel opus. ""Renan a refusé de mettre son magnifique talent à notre service en disant : 'Lolita [la fille de Renaud] n’aime pas Thierry'"", déclare l’évincé.</p>","<p><strong>Mistral gagnant.</strong> Quand il apparaît dans les années 1970, avec son air rebelle (mais pas trop) et son parlé verlan, l’Hexagone s’entiche de Renaud. Toute une jeunesse écoute ses chansons engagées le poing levé, s’émeut quand il évoque l’enfance et ""les bonbecs fabuleux qu’on piquait chez l’marchand"". La gloire est là, splendide, éclatante, bruyante. Elle éclabousse la famille, appartenant à une petite bourgeoisie aux prétentions intellectuelles. Le succès de Renaud et de ses chansons a tout bouleversé.</p>","<p><strong>Mistral perdant.</strong> Thierry en veut en réalité à son frère d’avoir anéanti son rêve de devenir chanteur. ""Il ne peut y avoir qu’un seul chanteur dans la famille"", lui aurait dit Renaud, après l’avoir empêché de signer dans une maison de disques. Thierry Séchan devra se satisfaire de deux premiers albums confidentiels, d’une veine poétique plutôt classique. Et celui qui se rêve également écrivain, pourtant doué, a dépensé son énergie littéraire en consacrant six livres à Renaud. Le cynique déclare : ""Parce que cela m’assure entre 15.000 et 25.000 ventes, de quoi payer mon loyer pendant deux ans.""</p>","<p>""On choisit ses copains mais rar’ment sa famille"", chantait Renaud. Cet artiste, à la carrière aussi chaotique que son humeur, a marqué toute une génération. Par faiblesse, désespoir ou nécessité, Thierry Séchan s’est contenté d’être son triste chroniqueur. Non sans une amertume qui, doublée d’une envie de piquer un peu de lumière à son frère ennemi, le pousse à s’exprimer publiquement. Pour une fois qu’on s’intéresse un peu à lui.</p>",Sophie Delassein,Baltel / Capman / SIPA,http://tempsreel.nouvelobs.com/journaliste/14866/sophie-delassein.html,adv1,oui,oui